Provincia;Via;PKInicio;PKFin;Tramo;Tipo;Causa;Calzada;RutaAlt;Observaciones;FechaAlta;MasInfo;Column 13
Ávila;CL-501;20.5;21.3;DE LA ADRADA (AV-930) A PIEDRALAVES;Precaución;Obras;Única;;Obras en la vía;2025-06-02T09:45:12+02:00;https://servicios.jcyl.es/InviPublica/index.html?numInci=225060;
Ávila;CL-605;81.0;81.2;DE VILLANUEVA DE ACERAL (AV-800) A MADRIGAL DE LAS ALTAS TORRES (CL-610);Precaución;Obras;Única;;Obras en la vía;2025-10-09T19:29:33+02:00;https://servicios.jcyl.es/InviPublica/index.html?numInci=226667;
Ávila;AV-413;0.0;0.84;DE ARÉVALO  A LÍMITE DE PROVINCIA DE SEGOVIA;Cortada;Obras;Única;;Obras en la vía;2025-05-06T14:12:02+02:00;https://servicios.jcyl.es/InviPublica/index.html?numInci=224727;
Ávila;AV-903;0.0;0.4;DE BURGOHONDO A AV-905;Precaución;Obras;Única;;--;2025-05-29T11:13:12+02:00;https://servicios.jcyl.es/InviPublica/index.html?numInci=225043;
Ávila;AV-913;16.44;16.55;DE SERRANILLOS A AV-922;Precaución;Obras;Única;;--;2025-05-29T11:11:56+02:00;https://servicios.jcyl.es/InviPublica/index.html?numInci=225042;
Burgos;BU-570;2.265;2.45;DE ESPINOSA DE LOS MONTEROS (BU-526) A SALCEDILLO (BU-572);Precaución;Obras;Única;;Obras en la vía;2025-10-14T13:53:26+02:00;https://servicios.jcyl.es/InviPublica/index.html?numInci=226705;
Burgos;BU-640;10.0;14.0;DE SASAMÓN A VILLADIEGO (BU-627);Precaución;Obras;Única;;Obras en la vía;2025-09-16T15:11:43+02:00;https://servicios.jcyl.es/InviPublica/index.html?numInci=226377;
León;CL-631;2.05;2.05;DE PONFERRADA (N-VI) INICIO DE AUTOVIA (CUBILLOS DEL SIL);Precaución;Otras;Única;;--;2025-10-09T15:10:42+02:00;https://servicios.jcyl.es/InviPublica/index.html?numInci=226664;
León;LE-524;2.5;3.2;DE VILLAQUEJIDA (N-630) A LÍMITE DE PROVINCIA DE ZAMORA;Precaución;Obras;Única;;Obras en la vía;2025-07-23T17:43:10+02:00;https://servicios.jcyl.es/InviPublica/index.html?numInci=225746;
León;LE-711;11.0;23.0;DE PONFERRADA (CL-631) A FABERO (LE-715);Circulación alternativa;Obras;Única;;Obras en la vía;2025-09-03T16:47:54+02:00;https://servicios.jcyl.es/InviPublica/index.html?numInci=226221;
Palencia;CL-613;0.0;1.87;DE PALENCIA (CL-615) A GRIJOTA (P-954);Precaución;Otras;Única;;--;2024-09-20T14:08:43+02:00;https://servicios.jcyl.es/InviPublica/index.html?numInci=216815;
Palencia;P-131;28.182;34.625;DE BALTANÁS (CL-619) A PALENZUELA (N-622);Precaución;Otras;Única;;--;2025-08-05T14:28:13+02:00;https://servicios.jcyl.es/InviPublica/index.html?numInci=225857;
Palencia;P-230;0.0;8.5;DE HERRERA DE PISUERGA (P-227) A SOTOBAÑADO (P-233);Precaución;Otras;Única;;--;2025-08-05T14:07:51+02:00;https://servicios.jcyl.es/InviPublica/index.html?numInci=225855;
Palencia;P-231;18.35;18.62;DE CALAHORRA DE BOEDO (P-232) A HERRERA DE PISUERGA (P-230);Precaución;Otras;Única;;--;2024-12-10T19:40:19+01:00;https://servicios.jcyl.es/InviPublica/index.html?numInci=218250;
Palencia;P-420;0.85;5.53;DE AMUSCO (N-611) A VALDESPINA (P-430);Precaución;Otras;Única;;--;2024-05-20T14:22:58+02:00;https://servicios.jcyl.es/InviPublica/index.html?numInci=215311;
Palencia;P-431;1.8;3.2;DE FRÓMISTA (N-611a) A P-403;Precaución;Obras;Única;;Obras en la vía;2025-06-17T13:54:44+02:00;https://servicios.jcyl.es/InviPublica/index.html?numInci=225279;
Palencia;P-431;3.2;3.52;DE FRÓMISTA (N-611a) A P-403;Precaución;Otras;Única;;--;2025-06-03T13:43:49+02:00;https://servicios.jcyl.es/InviPublica/index.html?numInci=225090;
Palencia;P-434;2.1;3.0;DE FRÓMISTA (P-431) A LÍMITE DE PROVINCIA DE BURGOS;Precaución;Obras;Única;;Obras en la vía;2025-10-03T12:13:26+02:00;https://servicios.jcyl.es/InviPublica/index.html?numInci=226578;
Palencia;P-922;12.55;12.75;DE P-912 A VILLARRAMIEL (N-610);Precaución;Obras;Única;;Obras en la vía;2025-06-04T12:11:51+02:00;https://servicios.jcyl.es/InviPublica/index.html?numInci=225117;
Palencia;P-953;0.0;6.95;DE LA VENTA (CL-615) A BECERRIL DE CAMPOS (CL-613);Precaución;Otras;Única;;Obras en la vía;2024-09-20T14:10:24+02:00;https://servicios.jcyl.es/InviPublica/index.html?numInci=216816;
Palencia;P-953;21.1;21.3;DE FUENTES DE NAVA (P-940) A AUTILLO DE CAMPOS (P-933);Precaución;Otras;Única;;--;2025-06-03T10:37:03+02:00;https://servicios.jcyl.es/InviPublica/index.html?numInci=225079;
Palencia;P-990;0.0;2.22;DE LA VENTA (CL-615) A MONZÓN DE CAMPOS (N-611);Precaución;Otras;Única;;--;2025-04-10T15:20:22+02:00;https://servicios.jcyl.es/InviPublica/index.html?numInci=224396;
Salamanca;CL-517;79.0;80.0;DE VITIGUDINO (SA-315) A LUMBRALES;Precaución;Otras;Única;;--;2025-10-22T10:23:33+02:00;https://servicios.jcyl.es/InviPublica/index.html?numInci=226783;
Salamanca;SA-104;0.0;7.455;DE GUIJUELO A LÍMITE DE PROVINCIA DE ÁVILA;Precaución;Obras;Única;;Obras en la vía;2025-10-06T10:14:36+02:00;https://servicios.jcyl.es/InviPublica/index.html?numInci=226591;
Salamanca;SA-105;4.0;10.0;DE PEÑARANDA DE BRACAMONTE (N-501) A SA-113 (MACOTERA);Precaución;Otras;Única;;--;2025-05-28T10:26:43+02:00;https://servicios.jcyl.es/InviPublica/index.html?numInci=225014;
Salamanca;SA-105;22.2;23.01;DE SA-113 (MACOTERA) A LÍMITE DE PROVINCIA DE ÁVILA;Precaución;Otras;Única;;--;2025-10-16T15:49:41+02:00;https://servicios.jcyl.es/InviPublica/index.html?numInci=226733;
Salamanca;SA-203;7.0;8.28;DE SA-201 A EL PASO DE LOS LOBOS;Circulación alternativa;Obras;Única;;Obras en la vía;2025-10-20T10:19:59+02:00;https://servicios.jcyl.es/InviPublica/index.html?numInci=226751;
Salamanca;SA-212;15.0;20.0;DE GUIJUELO (N-630) A LINARES DE RIOFRÍO (SA-205);Precaución;Obras;Única;;Obras en la vía;2025-10-06T16:44:19+02:00;https://servicios.jcyl.es/InviPublica/index.html?numInci=226608;
Salamanca;SA-214;21.8;22.22;DE GUIJUELO (N-630) A CRISTÓBAL (SA-220);Precaución;Otras;Única;;--;2025-10-22T10:02:20+02:00;https://servicios.jcyl.es/InviPublica/index.html?numInci=226777;
Segovia;CL-603;52.0;52.5;DE CANTALEJO (SG-205) A SG-231;Circulación alternativa;Obras;Única;;Pavimentación;2025-10-20T10:06:02+02:00;https://servicios.jcyl.es/InviPublica/index.html?numInci=226746;
Valladolid;CL-600;0.0;5.0;DE A-62 (SIMANCAS) A PUENTE DUERO (CL-610);Precaución;Obras;Única;;Pavimentación;2025-10-20T10:44:17+02:00;https://servicios.jcyl.es/InviPublica/index.html?numInci=226754;
Zamora;CL-527;0.0;3.67;DE ZAMORA A ZA-330;Precaución;Obras;Única;;--;2025-06-20T10:18:29+02:00;https://servicios.jcyl.es/InviPublica/index.html?numInci=225341;
Zamora;CL-527;3.67;15.33;DE ZA-330 A PERERUELA;Precaución;Obras;Única;;--;2025-06-20T10:19:20+02:00;https://servicios.jcyl.es/InviPublica/index.html?numInci=225342;
Zamora;CL-612;85.675;86.0;DE VILLALPANDO (N-VI) A CASTRONUEVO (ZA-702);Precaución;Obras;Única;;--;2025-10-10T15:19:14+02:00;https://servicios.jcyl.es/InviPublica/index.html?numInci=226687;
Zamora;ZA-102;9.37;21.01;DE ZA-101 A LÍMITE DE PROVINCIA DE ORENSE;Precaución;Otras;Única;;--;2025-09-26T15:09:16+02:00;https://servicios.jcyl.es/InviPublica/index.html?numInci=226501;
Zamora;ZA-306;15.05;22.0;DE ZA-302 A LÍMITE DE PROVINCIA DE SALAMANCA;Cortada;Obras;Única;;--;2025-10-22T10:33:02+02:00;https://servicios.jcyl.es/InviPublica/index.html?numInci=226785;
Zamora;ZA-306;17.5;18.3;DE ZA-302 A LÍMITE DE PROVINCIA DE SALAMANCA;Precaución;Obras;Única;;Obras en la vía;2025-01-02T09:22:49+01:00;https://servicios.jcyl.es/InviPublica/index.html?numInci=219117;
Zamora;ZA-604;0.0;9.68;DE LA BÓVEDA DE TORO (ZA-605) A FUENTELAPEÑA (ZA-602);Precaución;Obras;Única;;--;2025-03-31T11:41:24+02:00;https://servicios.jcyl.es/InviPublica/index.html?numInci=224251;
Zamora;ZA-604;9.68;19.19;DE FUENTELAPEÑA (ZA-602) A CAÑIZAL (CL-605);Cortada;Obras;Única;ZA-605 y CL-605;Incidencia en toda la carretera;2025-04-14T13:12:27+02:00;https://servicios.jcyl.es/InviPublica/index.html?numInci=224439;
Zamora;ZA-610;5.0;5.0;DE CL-605 A MORALEJA DEL VINO (ZA-623);Cortada;Obras;Única;;--;2025-10-21T10:18:08+02:00;https://servicios.jcyl.es/InviPublica/index.html?numInci=226764;
Zamora;ZA-610;31.6;31.75;DE VENIALBO (ZA-611) A LA BÓVEDA DE TORO (ZA-605);Precaución;Obras;Única;;--;2025-09-30T14:31:45+02:00;https://servicios.jcyl.es/InviPublica/index.html?numInci=226540;
Zamora;ZA-712;1.02;1.705;DE ZA-705 A LÍMITE T.M. TORO;Cortada;Obras;Única;Camino de  la Malina >>>> Camino del Poleo;Obras en la vía;2025-09-01T14:19:20+02:00;https://servicios.jcyl.es/InviPublica/index.html?numInci=226190;
Zamora;ZA-714;9.98;10.058;DE PAJARES DE LA LAMPREANA (ZA-P-2310) A CASTRONUEVO (CL-612);Cortada;Obras;Única;;--;2025-06-06T16:09:57+02:00;https://servicios.jcyl.es/InviPublica/index.html?numInci=225154;
Ávila;CL-505;21.0;29.74;DE AV-503 A NAVALPERAL DE PINARES (AV-502);Precaución;Obras;Única;;Obras en la vía;2025-10-22T10:10:43+02:00;https://servicios.jcyl.es/InviPublica/index.html?numInci=226779;
Ávila;CL-505;29.74;42.0;DE NAVALPERAL DE PINARES (AV-502) A LÍMITE DE C.A. DE MADRID;Precaución;Obras;Única;;Obras en la vía;2025-10-22T10:10:43+02:00;https://servicios.jcyl.es/InviPublica/index.html?numInci=226780;
Ávila;AV-501;20.0;26.0;DE AV-500A N-110;Precaución;Obras;Única;;Obras en la vía;2025-10-17T15:56:57+02:00;https://servicios.jcyl.es/InviPublica/index.html?numInci=226744;
Ávila;AV-913;16.3;16.44;DE BURGOHONDO (AV-901) A SERRANILLOS;Precaución;Obras;Única;;--;2025-05-29T11:11:56+02:00;https://servicios.jcyl.es/InviPublica/index.html?numInci=225041;
Ávila;AV-915;2.0;14.0;DE AV-911 A LÍMITE DE C.A. DE CASTILLA LA MANCHA;Precaución;Obras;Única;;Obras en la vía;2025-04-14T11:15:20+02:00;https://servicios.jcyl.es/InviPublica/index.html?numInci=224430;
Burgos;CL-620;0.6;0.7;DE LÍMITE DE C.A. DEL PAÍS VASCO A LÍMITE DE C.A. DEL PAÍS VASCO;Precaución;Obras;Única;;Obras en la vía;2024-12-10T13:11:42+01:00;https://servicios.jcyl.es/InviPublica/index.html?numInci=218225;
Burgos;BU-601;24.3;32.3;DE VILLADIEGO (BU-627) A BU-610;Precaución;Obras;Única;;Obras en la vía;2025-09-16T15:09:27+02:00;https://servicios.jcyl.es/InviPublica/index.html?numInci=226375;
Burgos;BU-601;32.3;46.72;DE BU-610 A MELGAR DE FERNAMENTAL (N-120);Precaución;Obras;Única;;Obras en la vía;2025-09-16T15:09:27+02:00;https://servicios.jcyl.es/InviPublica/index.html?numInci=226376;
Burgos;BU-627;37.4;37.9;DE SOTRESGUDO (BU-610) A LÍMITE DE PROVINCIA DE PALENCIA;Precaución;Obras;Única;;Obras en la vía;2025-10-06T09:38:18+02:00;https://servicios.jcyl.es/InviPublica/index.html?numInci=226586;
León;CL-626;161.6;169.5;DE PUENTE ALMUHEY (LE-232) A LÍMITE DE PROVINCIA DE PALENCIA;Precaución;Obras;Única;;Obras en la vía;2025-08-25T10:28:20+02:00;https://servicios.jcyl.es/InviPublica/index.html?numInci=226079;
León;LE-164;0.5;42.9;DE PUENTE DE DOMINGO FLÓREZ (N-536) A LA BAÑA (LE-126);Precaución;Desprendimientos;Única;;Obstáculos/objetos en la calzada;2022-12-07T15:39:17+01:00;https://servicios.jcyl.es/InviPublica/index.html?numInci=197432;
Palencia;CL-613;37.3;37.5;DE CISNEROS (P-970) A VILLADA (P-905);Precaución;Otras;Única;;--;2025-08-14T23:42:03+02:00;https://servicios.jcyl.es/InviPublica/index.html?numInci=225996;
Palencia;CL-613;39.0;39.2;DE CISNEROS (P-970) A VILLADA (P-905);Precaución;Otras;Única;;--;2025-04-11T11:01:27+02:00;https://servicios.jcyl.es/InviPublica/index.html?numInci=224413;
Palencia;CL-615;0.0;1.3;DE PALENCIA A VILLALDAVÍN (P-960);Precaución;Otras;Única;;--;2025-02-14T15:46:45+01:00;https://servicios.jcyl.es/InviPublica/index.html?numInci=222185;
Palencia;P-121;0.0;3.2;DE N-620 A VALLE DE CERRATO (P-131);Precaución;Otras;Única;;--;2025-08-05T13:50:58+02:00;https://servicios.jcyl.es/InviPublica/index.html?numInci=225853;
Palencia;P-121;3.2;6.2;DE N-620 A VALLE DE CERRATO (P-131);Precaución;Obras;Única;;Obras en la vía;2024-06-06T09:58:04+02:00;https://servicios.jcyl.es/InviPublica/index.html?numInci=215547;
Palencia;P-141;26.075;26.155;DE ANTIGÜEDAD A ESPINOSA DE CERRATO;Precaución;Otras;Única;;--;2024-07-30T15:44:24+02:00;https://servicios.jcyl.es/InviPublica/index.html?numInci=216296;
Palencia;P-210;14.4;14.7;DE P-211 A CARDAÑO DE ABAJO (P-217);Circulación alternativa;Obras;Única;;Obras en la vía;2025-10-22T10:53:41+02:00;https://servicios.jcyl.es/InviPublica/index.html?numInci=226789;
Palencia;P-227;29.3;34.4;DE LA VID DE OJEDA (P-223) A HERRERA DE PISUERGA;Precaución;Otras;Única;;--;2025-04-04T13:50:27+02:00;https://servicios.jcyl.es/InviPublica/index.html?numInci=224325;
Palencia;P-231;13.54;18.2;DE CALAHORRA DE BOEDO (P-232) A HERRERA DE PISUERGA (P-230);Precaución;Otras;Única;;--;2024-12-10T19:33:45+01:00;https://servicios.jcyl.es/InviPublica/index.html?numInci=218248;
Palencia;P-231;17.3;17.9;DE CALAHORRA DE BOEDO (P-232) A HERRERA DE PISUERGA (P-230);Cortada;Obras;Única;;Obras en la vía;2025-02-06T09:27:00+01:00;https://servicios.jcyl.es/InviPublica/index.html?numInci=221316;
Palencia;P-232;7.75;12.02;DE N-611 A CALAHORRA DE BOEDO (P-232);Precaución;Otras;Única;;--;2024-12-10T19:30:50+01:00;https://servicios.jcyl.es/InviPublica/index.html?numInci=218246;
Palencia;P-232;12.02;17.07;DE CALAHORRA DE BOEDO (P-232) A SOTOBAÑADO (P-230);Precaución;Otras;Única;;--;2025-08-05T14:04:12+02:00;https://servicios.jcyl.es/InviPublica/index.html?numInci=225854;
Palencia;P-245;0.695;4.8;DE OSORNO (N-120) A VILLASARRACINO (P-236);Precaución;Obras;Única;;--;2024-08-09T15:09:31+02:00;https://servicios.jcyl.es/InviPublica/index.html?numInci=216449;
Palencia;P-430;0.0;2.96;DE FRÓMISTA (P-431) A VALDESPINA (P-420);Precaución;Otras;Única;;--;2025-10-03T12:38:32+02:00;https://servicios.jcyl.es/InviPublica/index.html?numInci=226580;
Palencia;P-430;2.96;3.8;DE FRÓMISTA (P-431) A VALDESPINA (P-420);Precaución;Obras;Única;;Obras en la vía;2025-10-03T12:39:05+02:00;https://servicios.jcyl.es/InviPublica/index.html?numInci=226581;
Palencia;P-431;0.0;1.8;DE FRÓMISTA (N-611a) A P-403;Precaución;Otras;Única;;--;2024-06-04T11:21:20+02:00;https://servicios.jcyl.es/InviPublica/index.html?numInci=215508;
Palencia;P-431;3.52;13.04;DE P-403 A ASTUDILLO (P-405);Precaución;Otras;Única;;--;2025-06-03T13:43:49+02:00;https://servicios.jcyl.es/InviPublica/index.html?numInci=225091;
Palencia;P-953;15.3;15.5;DE BECERRIL DE CAMPOS (CL-613) A FUENTES DE NAVA (P-940);Precaución;Otras;Única;;--;2025-07-18T15:46:04+02:00;https://servicios.jcyl.es/InviPublica/index.html?numInci=225682;
Palencia;P-981;0.0;9.56;DE VILLOLDO (CL-615a) A VILLALCÁZAR DE SIRGA (P-980);Precaución;Otras;Única;;--;2025-09-30T13:14:08+02:00;https://servicios.jcyl.es/InviPublica/index.html?numInci=226538;
Palencia;P-981;22.625;23.389;DE VILLALCÁZAR DE SIRGA (P-980) A A-67 (SANTILLANA DE CAMPOS);Precaución;Obras;Única;;--;2024-12-06T12:05:53+01:00;https://servicios.jcyl.es/InviPublica/index.html?numInci=217721;
Palencia;P-984;0.0;6.0;DE N-611 A SAN CEBRIÁN DE CAMPOS (P-983);Precaución;Otras;Única;;--;2024-09-30T09:59:05+02:00;https://servicios.jcyl.es/InviPublica/index.html?numInci=216904;
Salamanca;SA-205;22.65;22.7;DE SA-210 A LINARES DE RIOFRÍO;Circulación alternativa;Obras;Única;;--;2025-10-14T11:45:33+02:00;https://servicios.jcyl.es/InviPublica/index.html?numInci=226700;
Salamanca;SA-211;0.0;10.0;DE N-620 A VECINOS;Precaución;Otras;Única;;--;2025-10-22T10:21:17+02:00;https://servicios.jcyl.es/InviPublica/index.html?numInci=226781;
Segovia;SG-205;30.3;31.5;DE CANTALEJO (CL-603) A HONTALBILLA (SG-211);Precaución;Obras;Única;;Pavimentación;2025-10-20T10:04:22+02:00;https://servicios.jcyl.es/InviPublica/index.html?numInci=226745;
Segovia;SG-222;14.0;16.0;DE AGUILAFUENTE A NAVALMANZANO (A-601);Precaución;Obras;Única;;--;2025-10-22T11:11:26+02:00;https://servicios.jcyl.es/InviPublica/index.html?numInci=226790;
Segovia;SG-231;0.0;9.5;DE CL-603 A SG-205;Precaución;Obras;Única;;--;2025-10-22T10:29:16+02:00;https://servicios.jcyl.es/InviPublica/index.html?numInci=226784;
Soria;SO-132;2.7;2.8;DE MEDINACELI (N-IIa) A BARAHONA (CL-101);Precaución;Obras;Única;;Obras en la vía;2025-10-14T12:47:52+02:00;https://servicios.jcyl.es/InviPublica/index.html?numInci=226703;
Valladolid;VA-511;0.0;7.0;DE CASTROMONTE (VA-515) A VILLABRÁGIMA (VA-505);Precaución;Otras;Única;;--;2025-10-22T10:40:26+02:00;https://servicios.jcyl.es/InviPublica/index.html?numInci=226786;
Zamora;CL-612;85.0;85.675;DE VILLALPANDO (N-VI) A CASTRONUEVO (ZA-702);Cortada;Obras;Única;;--;2025-10-10T15:13:28+02:00;https://servicios.jcyl.es/InviPublica/index.html?numInci=226686;
Zamora;ZA-101;0.0;3.41;DE PÍAS (ZA-102) A BARJACOBA;Precaución;Otras;Única;;--;2025-09-26T15:13:32+02:00;https://servicios.jcyl.es/InviPublica/index.html?numInci=226503;
Zamora;ZA-102;1.07;9.37;DE LÍMITE DE PROVINCIA DE ORENSE A ZA-101;Precaución;Otras;Única;;--;2025-09-26T15:08:18+02:00;https://servicios.jcyl.es/InviPublica/index.html?numInci=226500;
Zamora;ZA-714;9.665;9.979;DE RIEGO DEL CAMINO (N-630) A PAJARES DE LA LAMPREANA;Cortada;Obras;Única;;--;2025-06-06T16:10:42+02:00;https://servicios.jcyl.es/InviPublica/index.html?numInci=225155;
Zamora;ZA-921;7.0;13.0;DE PUEBLA DE SANABRIA (ZA-925) A LÍMITE CON PORTUGAL (RIHONOR DE CASTILLA);Precaución;Otras;Única;;--;2025-04-08T12:41:18+02:00;https://servicios.jcyl.es/InviPublica/index.html?numInci=224365;
Ávila;CL-605;51.93;54.0;DE LÍMITE DE PROVINCIA DE SEGOVIA A A-6;Precaución;Obras;Única;;Obras en la vía;2025-09-15T09:44:25+02:00;https://servicios.jcyl.es/InviPublica/index.html?numInci=226340;
Ávila;CL-605;54.0;57.0;DE A-6 A AV-810;Precaución;Obras;Única;;Obras en la vía;2025-09-15T09:44:25+02:00;https://servicios.jcyl.es/InviPublica/index.html?numInci=226341;
Ávila;AV-915;0.0;2.0;DE SOTILLO DE LA ADRADA (CL-501) A AV-911;Precaución;Obras;Única;;Obras en la vía;2025-04-14T11:15:20+02:00;https://servicios.jcyl.es/InviPublica/index.html?numInci=224429;
Burgos;CL-630;2.3;2.4;DE N-623 A LÍMITE DE C.A. DE CANTABRIA;Precaución;Otras;Única;;Obstáculos/objetos en la calzada;2025-09-24T14:35:58+02:00;https://servicios.jcyl.es/InviPublica/index.html?numInci=226470;
Burgos;BU-825;0.0;14.0;DE SALAS DE LOS INFANTES (N-234) A BU-820;Precaución;Obras;Única;;Obras en la vía;2025-10-14T13:04:55+02:00;https://servicios.jcyl.es/InviPublica/index.html?numInci=226704;
León;CL-626;10.0;14.1;DE CABOALLES DE ABAJO (LE-497) A RIOSCURO (LE-493);Precaución;Obras;Única;;Obras en la vía;2025-09-30T12:23:39+02:00;https://servicios.jcyl.es/InviPublica/index.html?numInci=226535;
León;CL-626;14.1;18.0;DE RIOSCURO (LE-493) A PIEDRAFITA DE BABIA (LE-495);Precaución;Obras;Única;;Obras en la vía;2025-09-30T12:23:39+02:00;https://servicios.jcyl.es/InviPublica/index.html?numInci=226536;
León;CL-626;80.7;80.7;DE LA MAGDALENA (LE-420) A LA ROBLA (N-630);Circulación alternativa;Obras;Única;;Obras en la vía;2025-09-17T12:11:47+02:00;https://servicios.jcyl.es/InviPublica/index.html?numInci=226398;
León;CL-631;2.8;2.8;DE PONFERRADA (N-VI) INICIO DE AUTOVIA (CUBILLOS DEL SIL);Precaución;Otras;Única;;--;2025-10-09T15:02:58+02:00;https://servicios.jcyl.es/InviPublica/index.html?numInci=226663;
León;LE-497;2.55;2.95;DE CABOALLES DE ABAJO (CL-626) A LÍMITE DE C.A. DE ASTURIAS;Precaución;Otras;Única;;Obstáculos/objetos en la calzada;2025-03-02T09:21:08+01:00;https://servicios.jcyl.es/InviPublica/index.html?numInci=222478;
Palencia;CL-613;1.87;13.0;DE GRIJOTA (P-954) A PAREDES DE NAVA;Precaución;Otras;Única;;--;2024-09-20T14:07:56+02:00;https://servicios.jcyl.es/InviPublica/index.html?numInci=216814;
Palencia;P-131;0.0;6.0;DE CEVICO DE LA TORRE (P-110) A VALLE DE CERRATO (P-121);Precaución;Obras;Única;;Obras en la vía;2025-09-17T13:17:23+02:00;https://servicios.jcyl.es/InviPublica/index.html?numInci=226399;
Palencia;P-131;15.0;18.0;DE VALLE DE CERRATO (P-121) A BALTANÁS (CL-619);Precaución;Obras;Única;;Obras en la vía;2025-09-18T13:27:25+02:00;https://servicios.jcyl.es/InviPublica/index.html?numInci=226414;
Palencia;P-210;28.35;28.55;DE P-211 A CARDAÑO DE ABAJO (P-217);Precaución;Otras;Única;;--;2025-09-12T15:34:50+02:00;https://servicios.jcyl.es/InviPublica/index.html?numInci=226334;
Palencia;P-227;33.2;33.6;DE LA VID DE OJEDA (P-223) A HERRERA DE PISUERGA;Precaución;Obras;Única;;--;2025-04-04T13:50:55+02:00;https://servicios.jcyl.es/InviPublica/index.html?numInci=224326;
Palencia;P-420;0.0;0.85;DE AMUSCO (N-611) A VALDESPINA (P-430);Precaución;Obras;Única;;Obras en la vía;2024-05-29T20:31:31+02:00;https://servicios.jcyl.es/InviPublica/index.html?numInci=215445;
Palencia;P-430;3.8;14.38;DE FRÓMISTA (P-431) A VALDESPINA (P-420);Precaución;Otras;Única;;--;2025-10-03T12:39:25+02:00;https://servicios.jcyl.es/InviPublica/index.html?numInci=226582;
Palencia;P-434;0.0;2.1;DE FRÓMISTA (P-431) A LÍMITE DE PROVINCIA DE BURGOS;Precaución;Otras;Única;;--;2025-10-03T12:12:28+02:00;https://servicios.jcyl.es/InviPublica/index.html?numInci=226577;
Palencia;P-434;3.0;6.5;DE FRÓMISTA (P-431) A LÍMITE DE PROVINCIA DE BURGOS;Precaución;Otras;Única;;--;2025-10-03T12:13:49+02:00;https://servicios.jcyl.es/InviPublica/index.html?numInci=226579;
Palencia;P-980;1.0;1.2;DE CARRIÓN DE LOS CONDES (N-120) A VILLALCÁZAR DE SIRGA (P-981);Precaución;Otras;Única;;--;2025-08-14T15:12:08+02:00;https://servicios.jcyl.es/InviPublica/index.html?numInci=225985;
Palencia;P-981;9.56;13.79;DE VILLALCÁZAR DE SIRGA (P-980) A A-67 (SANTILLANA DE CAMPOS);Precaución;Otras;Única;;--;2025-09-30T13:15:06+02:00;https://servicios.jcyl.es/InviPublica/index.html?numInci=226539;
Palencia;P-991;0.0;2.75;DE MONZÓN DE CAMPOS (N-611) A CL-615;Precaución;Obras;Única;;--;2025-07-23T18:00:51+02:00;https://servicios.jcyl.es/InviPublica/index.html?numInci=225747;
Salamanca;SA-104;0.9;1.58;DE GUIJUELO A LÍMITE DE PROVINCIA DE ÁVILA;Cortada;Obras;Única;A través del enlace 387 de la autovía A-66.;Obras en la vía;2025-10-09T10:57:37+02:00;https://servicios.jcyl.es/InviPublica/index.html?numInci=226660;
Salamanca;SA-104;4.8;7.455;DE GUIJUELO A LÍMITE DE PROVINCIA DE ÁVILA;Circulación alternativa;Obras;Única;;Obras en la vía;2025-10-09T10:55:45+02:00;https://servicios.jcyl.es/InviPublica/index.html?numInci=226659;
Salamanca;SA-220;19.0;21.0;DE CARRETERA A NAVALMORAL DE BÉJAR A SANTIBÁÑEZ DE LA SIERRA (SA-205);Precaución;Otras;Única;;--;2025-10-22T10:22:59+02:00;https://servicios.jcyl.es/InviPublica/index.html?numInci=226782;
Salamanca;SA-801;17.0;17.2;DE SA-810 A CL-605;Precaución;Otras;Única;;--;2025-10-22T10:51:45+02:00;https://servicios.jcyl.es/InviPublica/index.html?numInci=226788;
Salamanca;SA-801;21.0;24.0;DE SA-810 A CL-605;Precaución;Otras;Única;;--;2025-05-20T15:51:23+02:00;https://servicios.jcyl.es/InviPublica/index.html?numInci=224908;
Segovia;CL-602;103.2;103.3;DE LÍMITE DE PROVINCIA DE VALLADOLID A CUÉLLAR;Precaución;Obras;Única;;--;2025-10-20T14:34:55+02:00;https://servicios.jcyl.es/InviPublica/index.html?numInci=226760;
Segovia;CL-603;47.5;48.5;DE SAN MIGUEL DE BERNUY A CANTALEJO (SG-205);Precaución;Obras;Única;Desvío por las calles de la localidad.;Pavimentación;2025-10-17T11:49:17+02:00;https://servicios.jcyl.es/InviPublica/index.html?numInci=226740;
Segovia;SG-322;11.7;20.67;DE N-110 A MUÑOPEDRO;Precaución;Obras;Única;;--;2025-09-26T13:23:37+02:00;https://servicios.jcyl.es/InviPublica/index.html?numInci=226496;
Soria;SO-630;0.0;0.5;DE SO-615 A SAN PEDRO MANRIQUE (SO-650);Cortada;Obras;Única;;Obras en la vía;2025-10-14T10:20:59+02:00;https://servicios.jcyl.es/InviPublica/index.html?numInci=226691;
Soria;SO-630;0.5;11.24;DE SO-615 A SAN PEDRO MANRIQUE (SO-650);Precaución;Obras;Única;;Obras en la vía;2025-10-14T10:21:28+02:00;https://servicios.jcyl.es/InviPublica/index.html?numInci=226692;
Soria;SO-630;24.5;40.05;DE SAN PEDRO MANRIQUE (SO-650) A CASTILRUIZ;Precaución;Obras;Única;;Obras en la vía;2025-09-12T12:23:49+02:00;https://servicios.jcyl.es/InviPublica/index.html?numInci=226323;
Zamora;CL-527;36.1;37.0;DE BERMILLO DE SAYAGO A ZA-315;Precaución;Obras;Única;;Obras en la vía;2025-10-07T13:56:55+02:00;https://servicios.jcyl.es/InviPublica/index.html?numInci=226627;
Zamora;ZA-102;0.0;1.07;DE N-525 A LÍMITE DE PROVINCIA DE ORENSE (TRAMO EN LA PROVINCIA DE ORENSE);Precaución;Otras;Única;;--;2025-09-26T15:10:03+02:00;https://servicios.jcyl.es/InviPublica/index.html?numInci=226502;
Zamora;ZA-316;0.0;0.2;DE FERMOSELLE (CL-527) A LÍMITE DE PROVINCIA DE SALAMANCA;Precaución;Obras;Única;;--;2025-10-21T13:05:19+02:00;https://servicios.jcyl.es/InviPublica/index.html?numInci=226775;
Zamora;ZA-324;29.08;29.08;DE MORALINA (ZA-311) A LÍMITE CON PORTUGAL;Precaución;Obras;Única;;Obras en la vía;2025-10-22T10:43:58+02:00;https://servicios.jcyl.es/InviPublica/index.html?numInci=226787;
Zamora;ZA-512;0.98;2.98;DE VILLALPANDO (CL-612) A VILLANUEVA DEL CAMPO (N-610);Precaución;Obras;Única;;--;2025-01-02T15:27:14+01:00;https://servicios.jcyl.es/InviPublica/index.html?numInci=219209;
